<?xml version="1.0" encoding="UTF-8"?>
<Simulation xmlns:xsi="http://www.w3.org/2001/XMLSchema-instance"
            xsi:noNamespaceSchemaLocation="../input/XMLFormat.xsd">
    <OutputFile OutputFileName="periodic"/>
    <EndTime>25.0</EndTime>
    <TimeStepSize>0.0005</TimeStepSize>
    <ForceCalculation>
        <LennardJonesCell Epsilon="1.0" Sigma="1.0"/>
    </ForceCalculation>
    <AverageBrownianMotion>0.01</AverageBrownianMotion>
    <SimulationStrategy>
        <LinkedCell>
            <BoundaryBox>
                <BoxSize X="80.0" Y="50.0" Z="1.0"/>
                <Front>Reflecting</Front>
                <Rear>Reflecting</Rear>
                <Left>Periodic</Left>
                <Right>Periodic</Right>
                <Top>Reflecting</Top>
                <Bottom>Reflecting</Bottom>
            </BoundaryBox>
            <CutoffRadius>2.5</CutoffRadius>
        </LinkedCell>
    </SimulationStrategy>
    <Dimensions>2</Dimensions>
    <FileType>
        <Input>
            <ShapeList>
                <Shape>
                    <Sphere Radius="15" Spacing="1.1225" Mass="1.0">
                        <Position X="60.0" Y="25.0" Z="0.0"/>
                        <Velocity X="20.0" Y="0.0" Z="0.0"/>
                    </Sphere>
                </Shape>
                <Shape>
                    <Cuboid Spacing="1.0" Mass="2.0">
                        <Position X="1.0" Y="1.0" Z="0.0"/>
                        <Velocity X="0.0" Y="0.0" Z="0.0"/>
                        <Dimensions X="40" Y="40" Z="1"/>
                    </Cuboid>
                </Shape>
            </ShapeList>
        </Input>
    </FileType>
</Simulation>